Source,Title,Summary,Link
Guardian Nigeria,2027: AA slams INEC over alleged plot to replace state chairmen,Leadership of the Action Alliance (AA) has threatened further legal action against the Independent National Electoral Commission (INEC) If the commission bows to pressure to replace the list of its state chairmen across the 36 states and the Federal Capital .,https://guardian.ng/politics/2027-aa-slams-inec-over-alleged-plot-to-replace-state-chairmen/
Guardian Nigeria,Lagos-Calabar highway: FG secures $747m loan from Deutsche Bank,"The Federal Government has secured a $747 million loan to finance Phase 1 Section 1 of the Lagos-Calabar Highway . The Ministry of Finance says the Federal Government, in collaboration with Deutsche Bank, has secured the loan . In a statement by the Director of Information and Public Relations, the ministry said the loan was secured by Deutsche",https://guardian.ng/news/lagos-calabar-highway-fg-secures-747m-loan-from-deutsche-bank/
Guardian Nigeria,2027: ADC launches chapter in Benue,The opposition African Democratic Congress (ADC) launches its chapter in Benue State . It is part of ongoing efforts to unseat the Governor of Benue .,https://guardian.ng/politics/2027-adc-launches-chapter-in-benue/
Guardian Nigeria,Is soda safe for children? Doctors explain health risks,"Soda might seem like a harmless treat for children, especially during birthdays, outings or Sunday lunch . But health experts are saying it may not be as innocent as many believe . Some parents feel that a little of these touted drinks are dangerous .",https://guardian.ng/life/wellness/is-soda-safe-for-children-doctors-explain-health-risks/
Guardian Nigeria,"Ogbonna was found guilty of armed robbery, murder – Ogun govt","Ogbonna Ogbojionu was found guilty of armed robbery, murder – Ogun govt . The government warned Ogbojuju to lead a quiet life if he is truly reformed . Ogun State Government warns Ogbojin to stop rewriting the facts .",https://guardian.ng/news/nigeria/metro/ogbonna-was-found-guilty-of-armed-robbery-murder-ogun-govt/
Vanguard Nigeria,"2027: Avoid triggering public disorder, NNPP warns ADC Pub. Sec, politicians","The New Nigeria Peoples Party (NNPP) faulted allegations by Malam Bolaji Abdullahi, interim National Publicity Secretary of the African Democratic Congress (ADC) The ADC on Monday, accused President Bola Tinubu’s administration of targeting its leaders in the North East and North East .",https://www.vanguardngr.com/2025/07/2027-avoid-triggering-public-disorder-nnpp-warns-adc-pub-sec-politicians/
Vanguard Nigeria,AI Tools That Streamline Daily Forex News for Faster Decisions,"Artificial intelligence is fast becoming the extra pair of eyes that Nigerian forex traders never had . AI platforms shorten the time between information and action by converting global data streams into clear, local insights in seconds .",https://www.vanguardngr.com/2025/07/ai-tools-that-streamline-daily-forex-news-for-faster-decisions/
Vanguard Nigeria,5 Best Crypto Casinos: Which Crypto  Casinos Top The List In 2025? Check Now!,"In 2025, the best crypto casinos like JACKBIT, 7Bit Casino, KatsuBet, BitStarz, and MIRAX Casino are redefining online gaming with lightning-fast transactions, unparalleled privacy, and a treasure trove of games that cater to every taste . Imagine diving into a world where cutting-edge blockchain technology meets heart",https://www.vanguardngr.com/2025/07/5-best-crypto-casinos-which-crypto-casinos-top-the-list-in-2025-check-now/
Vanguard Nigeria,Israel killed 12 journalists during war – Iran,Israel killed 12 journalists during war – Iran . Retaliatory Iranian drone and missile barrages killed at least 28 people in Israel during the war .,https://www.vanguardngr.com/2025/07/israel-killed-12-journalists-during-war-iran/
Vanguard Nigeria,Europe court says Semenya’s trial wasn’t fair in gender testing case,"Semenya ""had not benefitted from the safeguards provided for"" a fair trial in the European Convention on Human Rights . It ruled that, as such, as . such, it ruled that as such a fair . trial was not allowed to be carried out in accordance with the rights of a woman in a gender test .",https://www.vanguardngr.com/2025/07/europe-court-says-semenyas-trial-wasnt-fair-in-gender-testing-case/
