Source,Title,Summary,Link
Guardian Nigeria,Married to a spouse who worries a lot,"Worrying is a lack of faith in God . The average person is more concerned about things he does not have . Most times, our minds are filled with different worries .",https://guardian.ng/sunday-magazine/ibru-ecumenical-centre/married-to-a-spouse-who-worries-a-lot-2/
Guardian Nigeria,God rewards faithfulness – Part 1,Jesus Christ emphasises the importance of faithfulness in our pilgrimage to heaven by faith . We are required to be “faithful in that which is least… (and)in much” This faithfulness is expected of all believers .,https://guardian.ng/sunday-magazine/ibru-ecumenical-centre/god-rewards-faithfulness-part-1/
Guardian Nigeria,"While the bridegroom tarries, prepare","God is a perfect being; He is, therefore, serious and meticulous in whatsoever He does . People who profess serving Him must be like Him and must not do things haphazardly .",https://guardian.ng/sunday-magazine/ibru-ecumenical-centre/while-the-bridegroom-tarries-prepare/
Guardian Nigeria,"Key into available local opportunities for economic breakthroughs, Adeboye enjoins Nigerians","Pastor Enoch AdejareAdeboye has called on Nigerians to be sensitive to opportunities that can take them out of the current doldrums and grasp them . The General Overseer, The Redeemed Christian Church of God (RCCG) worldwide, has called .",https://guardian.ng/sunday-magazine/ibru-ecumenical-centre/key-into-available-local-opportunities-for-economic-breakthroughs-adeboye-enjoins-nigerians/
Guardian Nigeria,Prayer of intercession – Part 2,Nehemiah was serving in a foreign land as the cupbearer to the Persian King . He provides a powerful example of intercessory prayer demonstrating a heart burdened for God's people and a willingness to seek God's intervention .,https://guardian.ng/sunday-magazine/ibru-ecumenical-centre/prayer-of-intercession-part-2/
Vanguard Nigeria,"Tinubu returns to Abuja after two-nation visit to Saint Lucia, Brazil","Tinubu returns to Abuja after two-nation visit to Saint Lucia, Brazil . Nigerian leader engaged with leaders in Saint Lucia and participated in the 17th BRICS Summit in Brazil .",https://www.vanguardngr.com/2025/07/tinubu-returns-to-abuja-after-two-nation-visit-to-saint-lucia-brazil/
Vanguard Nigeria,"From U.S., more trouble for Nigeria’s businesses, tech innovators, students","""The worst part is that this policy would increase the corruption in the process. No embassy, particularly in Nigeria, would tell you that there’s no corruption in visa issuance. So Nigerians pay a lot, and with this new policy, we probably have to pay more”",https://www.vanguardngr.com/2025/07/from-u-s-more-trouble-for-nigerias-businesses-tech-innovators-students/
Vanguard Nigeria,"2027: Atiku, Peter Obi, Amaechi, others stoke elite politics worries in ADC","Atiku, Peter Obi, Amaechi, others stoke elite politics worries in ADC . On the one hand, these figures bring name recognition, funding, and political strength . But on the other hand, their presence raises troubling question: Can a party led by the same familiar names really represent the people?",https://www.vanguardngr.com/2025/07/2027-atiku-peter-obi-amaechi-others-stoke-elite-politics-worries-in-adc/
Vanguard Nigeria,Lagos LG Polls: Our votes don’t count,"Most polling units across Lagos State were nearly empty, as voter apathy marred yesterday’s local government elections . LASIEC conducted the elections conducted by the Lagos state Independent Electoral Commission .",https://www.vanguardngr.com/2025/07/lagos-lg-polls-our-votes-dont-count-residents-explain-low-turnout/
Vanguard Nigeria,2027: ADC can unseat Tinubu — Dagogo,"Dr Farah Dagogo says the opposition African Democratic Congress (ADC) coalition can dislodge the ruling All Progressives Congress (APC) If internal democracy and unity are prioritised, he says .",https://www.vanguardngr.com/2025/07/2027-adc-can-unseat-tinubu-dagogo/
